{"created_at_ms":1,"document_renditions":[{"compatibility":null,"extensions":{},"language":"en","media_type":"text/plain","origin":"source","producer":null,"rendition_id":"sha256:a676903cd9d53b18c5834e688b6b9541c7aeb447c16226801e9cc5cb0116b00e","source_asset_id":"sha256:dddddddddddddddddddddddddddddddddddddddddddddddddddddddddddddddd","text_blob":{"digest":"sha256:eabbe92d729020cfb0b845e5351b089d0c38f2693b30d7bfdc62604258e34c61","embedded":true,"size_bytes":38}},{"compatibility":{"checks":["exact_text_match"],"verified_inputs":[{"rendition_id":"sha256:a676903cd9d53b18c5834e688b6b9541c7aeb447c16226801e9cc5cb0116b00e","resource_id":null}]},"extensions":{},"language":"en","media_type":"text/plain","origin":"derived","producer":{"config_sha256":null,"created_at_ms":1,"model":null,"provider":null,"tool":{"id":"listen-gen","version":"0.4.0"}},"rendition_id":"sha256:c1312a391cc8f0c2aa98ac4e06c2d91f0197052fca0393830b164ddc90cbe6e1","source_asset_id":null,"text_blob":{"digest":"sha256:cd7cfca5bdf718ca475b5949cbd243a46220b928dbeadae897bc6ae15340aba1","embedded":false,"size_bytes":48}}],"edition":{"edition_id":"edition-composed-v1","support_languages":["zh-Hans"],"target_language":"en","title":"Composed Example Edition"},"extensions":{},"material":{"material_id":"material-composed-v1","material_revision_id":"revision-composed-v1","title":"Composed Example Material"},"media_renditions":[{"compatibility":null,"extensions":{},"fingerprint":"fp-source-composed","kind":"audio","media_blob":{"digest":"sha256:5382c9ebe85e6c41cb3d3322a61a8a011c7d249225df9178ae48e47c57c3fa0b","embedded":true,"size_bytes":29},"media_id":"media-1","media_type":"audio/mpeg","origin":"source","producer":null,"rendition_id":"sha256:19d205dee6d7e1306cbdcdb9e72dbd21125dd329ae39532ba7b7c4d7a48e8b73"},{"compatibility":{"checks":["exact_text_match"],"verified_inputs":[{"rendition_id":"sha256:a676903cd9d53b18c5834e688b6b9541c7aeb447c16226801e9cc5cb0116b00e","resource_id":null}]},"extensions":{},"fingerprint":"fp-derived-composed","kind":"audio","media_blob":{"digest":"sha256:eeeeeeeeeeeeeeeeeeeeeeeeeeeeeeeeeeeeeeeeeeeeeeeeeeeeeeeeeeeeeeee","embedded":false,"size_bytes":200},"media_id":null,"media_type":"audio/mpeg","origin":"derived","producer":{"config_sha256":null,"created_at_ms":1,"model":null,"provider":null,"tool":{"id":"listen-gen","version":"0.4.0"}},"rendition_id":"sha256:31cda2f1e97cf9eaebe8597e960028cdb34e997447ed8469e37dbcfae68092fb"}],"resources":[{"descriptor":{"content_language":"en","dependencies":[],"extensions":{},"kind":"structured_reading","payload_blob":{"digest":"sha256:b9f97d10ef4b46051d2810f8419a36386f279a60fa2646f99334fb48f14758b0","embedded":true,"size_bytes":1013},"provenance":{"config_sha256":null,"created_at_ms":1,"extensions":{},"input_rendition_ids":[],"input_resource_ids":[],"model":null,"provider":null,"tool":{"id":"listen-gen","version":"0.4.0"}},"quality":{"extensions":{},"review_status":"human_reviewed","warnings":[]},"role":"base","schema":"listen.payload.structured-reading.v1","subject":{"anchor_resource_ids":[],"material_revision_id":"revision-composed-v1","rendition_ids":[]},"support_languages":[]},"required":true,"resource_id":"sha256:bb581c3451d21f6dc6fd5d0756483ba558e910ccd8e281db4c7335c17e7cb81d"},{"descriptor":{"content_language":"en","dependencies":[],"extensions":{},"kind":"anchor_time_alignment","payload_blob":{"digest":"sha256:2d85f17b4ea7248b6620f4bbf67cd50650e6f696f2446e5c805511cae90b46f9","embedded":true,"size_bytes":377},"provenance":{"config_sha256":null,"created_at_ms":1,"extensions":{},"input_rendition_ids":[],"input_resource_ids":[],"model":null,"provider":null,"tool":{"id":"listen-gen","version":"0.4.0"}},"quality":{"extensions":{},"review_status":"human_reviewed","warnings":[]},"role":"base","schema":"listen.payload.anchor-time-alignment.v1","subject":{"anchor_resource_ids":[],"material_revision_id":"revision-composed-v1","rendition_ids":[]},"support_languages":[]},"required":true,"resource_id":"sha256:9cf9446b20846b2c03563904e713595d77e489fb10ef3776db266d1da165f117"},{"descriptor":{"dependencies":[{"resource_id":"sha256:bb581c3451d21f6dc6fd5d0756483ba558e910ccd8e281db4c7335c17e7cb81d"}],"extensions":{},"kind":"translation","payload_blob":{"digest":"sha256:b974227035ff4e0d7ba60a6bde13d04101053b240696cadc293cbd5c056ded9b","embedded":true,"size_bytes":476},"provenance":{"config_sha256":null,"created_at_ms":1,"extensions":{},"input_rendition_ids":[],"input_resource_ids":[],"model":null,"provider":null,"tool":{"id":"listen-gen","version":"0.4.0"}},"quality":{"extensions":{},"review_status":"machine_checked","warnings":[]},"role":"assistance","schema":"listen.payload.translation.v1","subject":{"anchor_resource_ids":[],"material_revision_id":"revision-composed-v1","rendition_ids":[]},"support_languages":["zh-Hans"]},"required":false,"resource_id":"sha256:c9e6c932a17a9b0fba9e4ea0ffddac988b79c0247bf9c344f1e23b4ca0c7efba"}],"schema":"listen.content-package.release.v3"}