{"created_at_ms":1,"document_renditions":[{"compatibility":null,"extensions":{},"language":"en","media_type":"text/plain","origin":"source","producer":null,"rendition_id":"sha256:a676903cd9d53b18c5834e688b6b9541c7aeb447c16226801e9cc5cb0116b00e","source_asset_id":"sha256:aaaaaaaaaaaaaaaaaaaaaaaaaaaaaaaaaaaaaaaaaaaaaaaaaaaaaaaaaaaaaaaa","text_blob":{"digest":"sha256:eabbe92d729020cfb0b845e5351b089d0c38f2693b30d7bfdc62604258e34c61","embedded":true,"size_bytes":38}}],"edition":{"edition_id":"edition-fixture-v1","support_languages":[],"target_language":"en","title":"Fixture Edition"},"extensions":{},"material":{"material_id":"material-fixture-v1","material_revision_id":"revision-fixture-v1","title":"Fixture Material"},"media_renditions":[],"resources":[{"descriptor":{"content_language":"en","dependencies":[],"extensions":{},"kind":"structured_reading","payload_blob":{"digest":"sha256:b9f97d10ef4b46051d2810f8419a36386f279a60fa2646f99334fb48f14758b0","embedded":true,"size_bytes":1013},"provenance":{"config_sha256":null,"created_at_ms":1,"extensions":{},"input_rendition_ids":[],"input_resource_ids":[],"model":null,"provider":null,"tool":{"id":"listen-gen","version":"0.4.0"}},"quality":{"extensions":{},"review_status":"human_reviewed","warnings":[]},"role":"base","schema":"listen.payload.structured-reading.v1","subject":{"anchor_resource_ids":[],"material_revision_id":"revision-fixture-v1","rendition_ids":[]},"support_languages":[]},"required":true,"resource_id":"sha256:5ecfe20c9e8d6d959dd93f12ec72ee092d2b5368d139e2c9ede92c9c8a6fe3e2"}],"schema":"listen.content-package.release.v3"}