{"created_at_ms":1,"document_renditions":[],"edition":{"edition_id":"edition-fixture-v1","support_languages":[],"target_language":"en","title":"Fixture Edition"},"extensions":{},"material":{"material_id":"material-fixture-v1","material_revision_id":"revision-fixture-v1","title":"Fixture Material"},"media_renditions":[{"compatibility":{"checks":["exact_text_match"],"verified_inputs":[]},"extensions":{},"fingerprint":"fp-derived-1","kind":"audio","media_blob":{"digest":"sha256:e323d2d613e601e3a66bbd1ca397d1f2753a18675332353cf40e23477db18696","embedded":true,"size_bytes":28},"media_id":null,"media_type":"audio/mpeg","origin":"derived","producer":{"config_sha256":null,"created_at_ms":1,"model":null,"provider":null,"tool":{"id":"listen-gen","version":"0.4.0"}},"rendition_id":"sha256:c86c8a49af01e716a10fbc6b8ae478d8d6a35906c56beec7bd97e2d0063f180a"},{"compatibility":null,"extensions":{},"fingerprint":"fp-source-1","kind":"audio","media_blob":{"digest":"sha256:cccccccccccccccccccccccccccccccccccccccccccccccccccccccccccccccc","embedded":false,"size_bytes":100},"media_id":"media-1","media_type":"audio/mpeg","origin":"source","producer":null,"rendition_id":"sha256:519c00c4e47eb9b68a1955e64fcdea5b6e4faa307cf710588b9edfc347823e7c"}],"resources":[{"descriptor":{"content_language":"en","dependencies":[],"extensions":{},"kind":"structured_reading","payload_blob":{"digest":"sha256:eefa7e5b7cf9f2fa4f8e68d69638840702c0311fb3d6a2d38bfcc9342d5cf22a","embedded":true,"size_bytes":784},"provenance":{"config_sha256":null,"created_at_ms":1,"extensions":{},"input_rendition_ids":[],"input_resource_ids":[],"model":null,"provider":null,"tool":{"id":"listen-gen","version":"0.4.0"}},"quality":{"extensions":{},"review_status":"human_reviewed","warnings":[]},"role":"base","schema":"listen.payload.structured-reading.v1","subject":{"anchor_resource_ids":[],"material_revision_id":"revision-fixture-v1","rendition_ids":[]},"support_languages":[]},"required":false,"resource_id":"sha256:1daadd668fc802f29efda9d3d13143507cc69f3b59913a91dc823cc960c2bdad"},{"descriptor":{"content_language":"en","dependencies":[],"extensions":{},"kind":"anchor_time_alignment","payload_blob":{"digest":"sha256:25840bb6a51589d4b050198cc79126e5aba07d176c1115d718db938deb9b81f6","embedded":true,"size_bytes":377},"provenance":{"config_sha256":null,"created_at_ms":1,"extensions":{},"input_rendition_ids":[],"input_resource_ids":[],"model":null,"provider":null,"tool":{"id":"listen-gen","version":"0.4.0"}},"quality":{"extensions":{},"review_status":"human_reviewed","warnings":[]},"role":"base","schema":"listen.payload.anchor-time-alignment.v1","subject":{"anchor_resource_ids":[],"material_revision_id":"revision-fixture-v1","rendition_ids":[]},"support_languages":[]},"required":false,"resource_id":"sha256:9fb534778fd7ebb5517bf5325e93a769b4cc69010fd15ecd2e5b0dfe9f0c58bf"}],"schema":"listen.content-package.release.v3"}